"name","begins","duration","time","description"
"Assessment preparation","after the signing of the agreement","one month","two weeks","To commence our engagement Service Provider will meet with IT/Operations leadership for an initial description of the situation and current landscape. Following that session Recipiant will provide Service Provider with any research materials that will be useful to inform Service Provider's knowledge of the organization its infrastructure work and the risks it faces."
"Reconnaissance","alongside assessment preparation","the entire length of the assessment","15 days","The Service Provider will identify publicly available resources (such as websites, extranets, email servers, but also social media information) connected to the organization and remotely gather information about those resources. It will include both passive reconnaissance of publicly available data sources and active external scans of Recipients network assets."
"Data assessment","at the start of the on-site engagement phase","throughout the length of the on-site phase","3 days","Service Provider will lead staff in activities where they identify where critical data currently resides (what devices/physical locations), who has access (physical, login, permissions), and who needs to have access to do their jobs."
"Threat assessment","for two days","on the first day of the on-site engagement","8 days","The Service Provider will carry out a variety of activities to identify possible attackers and gather background information about the capability of those attackers to threaten the Recipients organization. This will include identifying a particular attacker's history of carrying out specific threats, their capability to carry out those threats currently, and intent to expend their resources against the Recipient."
"Report Writing","after all on-site activities have completed","30 days","10 days","The Service Provider will compile their assessment notes and recommendations into a comprehensive set of documents the shows the current state of security, the process by which the Service Provider came to that assessment, and recommendations that will guide Recipient's progression to meet their security goals."
"Feedback and follow up activities","upon acceptance of final report","up to 30 days","up to 5 days","The Service Provider will lead a meeting with the primary point of contact to deliver and discuss the reports findings as well as a final follow-up meeting to explain recommendations and answer staff questions."
